{
  "$schema": "https://json-schema.org/draft/2020-12/schema",
  "$id": "urn:dumbmoney:schema:windows-runner-build:v1",
  "title": "DumbMoney private Windows runner build specification",
  "type": "object",
  "additionalProperties": false,
  "required": [
    "schema_version",
    "product",
    "deployment_scope",
    "build_authority",
    "service_control_mutations_authorized",
    "broker_actions_authorized",
    "builder",
    "desktop_artifact",
    "runners"
  ],
  "properties": {
    "schema_version": {
      "const": "dumbmoney.windows-runner-build.v1"
    },
    "product": {
      "const": "DumbMoney"
    },
    "deployment_scope": {
      "const": "PRIVATE_LOCAL_WINDOWS"
    },
    "build_authority": {
      "const": "PLAN_ONLY"
    },
    "service_control_mutations_authorized": {
      "const": false
    },
    "broker_actions_authorized": {
      "const": false
    },
    "builder": {
      "type": "object",
      "additionalProperties": false,
      "required": [
        "backend",
        "pyinstaller_version",
        "python_version",
        "python_executable_sha256",
        "git_executable_path",
        "git_executable_sha256",
        "powershell_executable_path",
        "powershell_executable_sha256",
        "source_date_epoch"
      ],
      "properties": {
        "backend": {
          "const": "PYINSTALLER_ONEFILE"
        },
        "pyinstaller_version": {
          "type": "string"
        },
        "python_version": {
          "type": "string"
        },
        "python_executable_sha256": {
          "type": "string"
        },
        "git_executable_path": {
          "type": "string"
        },
        "git_executable_sha256": {
          "type": "string"
        },
        "powershell_executable_path": {
          "type": "string"
        },
        "powershell_executable_sha256": {
          "type": "string"
        },
        "source_date_epoch": {
          "type": "integer",
          "minimum": 946684800,
          "maximum": 4102444800
        }
      }
    },
    "desktop_artifact": {
      "$ref": "#/$defs/desktopArtifact"
    },
    "runners": {
      "type": "array",
      "minItems": 5,
      "maxItems": 5,
      "items": {
        "$ref": "#/$defs/runner"
      }
    }
  },
  "$defs": {
    "desktopArtifact": {
      "type": "object",
      "additionalProperties": false,
      "required": [
        "artifact_name",
        "executable_name",
        "component",
        "sha256",
        "bytes",
        "authenticode_required"
      ],
      "properties": {
        "artifact_name": {
          "const": "desktop-executable"
        },
        "executable_name": {
          "const": "DumbMoney.exe"
        },
        "component": {
          "const": "blunder"
        },
        "sha256": {
          "type": "string"
        },
        "bytes": {
          "type": "integer",
          "minimum": 0
        },
        "authenticode_required": {
          "const": true
        }
      }
    },
    "runner": {
      "type": "object",
      "additionalProperties": false,
      "required": [
        "service_name",
        "command_ref",
        "executable_name",
        "component",
        "import_root",
        "entry_module",
        "entry_callable",
        "dependency_lock_path",
        "dependency_lock_sha256",
        "hidden_imports"
      ],
      "properties": {
        "service_name": {
          "enum": [
            "DumbMoneyCore",
            "DumbMoneyResearchMesh",
            "DumbMoneyModelGateway",
            "DumbMoneyDummyKalshi",
            "DumbMoneyDopeyRobinhood"
          ]
        },
        "command_ref": {
          "type": "string"
        },
        "executable_name": {
          "type": "string",
          "pattern": "^DumbMoney[A-Za-z]+\\.exe$"
        },
        "component": {
          "enum": [
            "blunder",
            "dummy",
            "dopey"
          ]
        },
        "import_root": {
          "type": "string"
        },
        "entry_module": {
          "type": "string"
        },
        "entry_callable": {
          "type": "string"
        },
        "dependency_lock_path": {
          "type": "string"
        },
        "dependency_lock_sha256": {
          "type": "string"
        },
        "hidden_imports": {
          "type": "array",
          "uniqueItems": true,
          "items": {
            "type": "string"
          }
        }
      }
    }
  }
}
