{
  "schema_version": "dumbmoney.windows-runner-build.v1",
  "product": "DumbMoney",
  "deployment_scope": "PRIVATE_LOCAL_WINDOWS",
  "build_authority": "PLAN_ONLY",
  "service_control_mutations_authorized": false,
  "broker_actions_authorized": false,
  "builder": {
    "backend": "PYINSTALLER_ONEFILE",
    "pyinstaller_version": "TO_BE_RESOLVED",
    "python_version": "TO_BE_RESOLVED",
    "python_executable_sha256": "TO_BE_RESOLVED",
    "git_executable_path": "TO_BE_RESOLVED",
    "git_executable_sha256": "TO_BE_RESOLVED",
    "powershell_executable_path": "TO_BE_RESOLVED",
    "powershell_executable_sha256": "TO_BE_RESOLVED",
    "source_date_epoch": 946684800
  },
  "desktop_artifact": {
    "artifact_name": "desktop-executable",
    "executable_name": "DumbMoney.exe",
    "component": "blunder",
    "sha256": "TO_BE_RESOLVED",
    "bytes": 0,
    "authenticode_required": true
  },
  "runners": [
    {
      "service_name": "DumbMoneyCore",
      "command_ref": "DUMBMONEY_CORE_COMMAND",
      "executable_name": "DumbMoneyCore.exe",
      "component": "blunder",
      "import_root": ".",
      "entry_module": "blunder.fund.entrypoint",
      "entry_callable": "main",
      "dependency_lock_path": "TO_BE_RESOLVED",
      "dependency_lock_sha256": "TO_BE_RESOLVED",
      "hidden_imports": []
    },
    {
      "service_name": "DumbMoneyResearchMesh",
      "command_ref": "DUMBMONEY_RESEARCH_MESH_COMMAND",
      "executable_name": "DumbMoneyResearchMesh.exe",
      "component": "blunder",
      "import_root": ".",
      "entry_module": "blunder.fund.research_entrypoint",
      "entry_callable": "main",
      "dependency_lock_path": "TO_BE_RESOLVED",
      "dependency_lock_sha256": "TO_BE_RESOLVED",
      "hidden_imports": []
    },
    {
      "service_name": "DumbMoneyModelGateway",
      "command_ref": "DUMBMONEY_MODEL_GATEWAY_COMMAND",
      "executable_name": "DumbMoneyModelGateway.exe",
      "component": "blunder",
      "import_root": ".",
      "entry_module": "blunder.fund.model_gateway_entrypoint",
      "entry_callable": "main",
      "dependency_lock_path": "TO_BE_RESOLVED",
      "dependency_lock_sha256": "TO_BE_RESOLVED",
      "hidden_imports": []
    },
    {
      "service_name": "DumbMoneyDummyKalshi",
      "command_ref": "DUMBMONEY_DUMMY_KALSHI_COMMAND",
      "executable_name": "DumbMoneyDummyKalshi.exe",
      "component": "dummy",
      "import_root": ".",
      "entry_module": "live_firewall.dumbmoney_windows_service",
      "entry_callable": "main",
      "dependency_lock_path": "TO_BE_RESOLVED",
      "dependency_lock_sha256": "TO_BE_RESOLVED",
      "hidden_imports": []
    },
    {
      "service_name": "DumbMoneyDopeyRobinhood",
      "command_ref": "DUMBMONEY_DOPEY_ROBINHOOD_COMMAND",
      "executable_name": "DumbMoneyDopeyRobinhood.exe",
      "component": "dopey",
      "import_root": ".",
      "entry_module": "dopey_live.dumbmoney_windows_service",
      "entry_callable": "main",
      "dependency_lock_path": "TO_BE_RESOLVED",
      "dependency_lock_sha256": "TO_BE_RESOLVED",
      "hidden_imports": []
    }
  ]
}
